{
  "config_hash": "03d9cf49be71c2b066ed7a1e774e4e24f12d05d2b9bc17c3de2a8d5b4bd4e390",
  "phase": "phase1",
  "run_id": "run-20260722T183018661588Z-03d9cf49be",
  "schema": "apex.kb.phase1-result.v2",
  "source_capsules": [
    {
      "authority": "Primary configured NARM theory source.",
      "content_hash": "64a0dae9c1cbc3bba6bd0299e345a4863560c6bce22b60444755585d0e06e6cd",
      "contradictions": [
        "The source includes more than one book-derived section and repeated material; no conflicting definition was found in the reviewed passages."
      ],
      "contributions": [
        "Defines NARM concepts and core needs.",
        "Describes regulation-oriented methods and cautions.",
        "Distinguishes developmental, shock, and attachment trauma in the source's own framework."
      ],
      "freshness": "Current configured source.",
      "key_claims": [
        "NARM identifies five core needs: contact, attunement, trust, autonomy, and love/sexuality.",
        "When early needs are not adequately met, the source describes adaptive survival strategies that can distort present experience.",
        "NARM emphasizes resources, present-moment contact, somatic mindfulness, containment, and titrated regulation rather than regression or catharsis."
      ],
      "pointers": [
        "line:3",
        "line:181",
        "line:187",
        "line:283",
        "line:327",
        "line:413",
        "line:479",
        "line:507",
        "line:5583",
        "line:5587"
      ],
      "repository_path": "apex-meta/kb/therapy/raw/notes/ET-Heller-NARM.md",
      "schema": "apex.kb.source-capsule.v2",
      "source_id": "src-c2fb4d779264e00e",
      "summary": "Primary NARM source describing developmental-trauma work as resource-oriented, present-focused, somatically informed work on contact, vitality, regulation, core needs, adaptive survival structures, shame, and relational capacity.",
      "title": "ET-Heller-NARM",
      "uncertainties": [
        "The source is German and book-derived; later translation should preserve terminology and avoid treating general theory as personal diagnosis."
      ]
    },
    {
      "authority": "Operator-related working formulation, not clinical diagnosis.",
      "content_hash": "ea19911591545b9ad39fb24e28356febb71a36efa991c8bbaaa8490cd80a3560",
      "contradictions": [],
      "contributions": [
        "Personal application context.",
        "Safety and support-style context.",
        "Later evidence for method ranking and therapy preparation."
      ],
      "freshness": "v1 source in the configured corpus.",
      "key_claims": [
        "The document frames its contents as support and working formulation rather than diagnosis.",
        "It identifies regulation, trust, anger, grief, and staged relationship access as practical themes.",
        "It contains explicit red flags and professional-care recommendations."
      ],
      "pointers": [
        "line:11",
        "line:92",
        "line:397",
        "line:519",
        "line:606",
        "line:678",
        "line:698"
      ],
      "repository_path": "apex-meta/kb/therapy/raw/notes/Psychological_Handover_Medical_Grade_v1.md",
      "schema": "apex.kb.source-capsule.v2",
      "source_id": "src-f7ded2930e8d80ad",
      "summary": "Personal working formulation and future-support handover that names presenting patterns, strengths, care boundaries, a NARM-informed therapeutic frame, practical protocols, and professional-care cautions.",
      "title": "Psychological Handover Medical Grade v1",
      "uncertainties": [
        "Personal hypotheses must not be promoted to clinical facts."
      ]
    },
    {
      "authority": "Operator-related reflection source.",
      "content_hash": "b2f3b75d5aab80d95c88b3b245478b15d9510637d41e63571f5619ccebf9a8b5",
      "contradictions": [],
      "contributions": [
        "Personal context for later NARM match work.",
        "Boundary against overclaiming clinical certainty."
      ],
      "freshness": "Current configured source.",
      "key_claims": [
        "The document explicitly says it is not a formal diagnosis.",
        "It describes anger and analytic rumination as protective patterns in a personal formulation.",
        "It names regulation, trust, attachment, and therapeutic-support priorities."
      ],
      "pointers": [
        "line:1",
        "line:9",
        "line:28",
        "line:56",
        "line:458",
        "line:507"
      ],
      "repository_path": "apex-meta/kb/therapy/raw/notes/PsychologicalHandover_ChatTherapeuticFramework_inACIM.md",
      "schema": "apex.kb.source-capsule.v2",
      "source_id": "src-9b22548c98e6481b",
      "summary": "Personal non-diagnostic handover describing relational vigilance, anger, grief, protective analysis, and a wish to combine truth, boundaries, release, and compassionate support.",
      "title": "Psychological Handover Chat Therapeutic Framework in ACIM",
      "uncertainties": [
        "The source is self-reflective and cannot establish NARM classifications."
      ]
    },
    {
      "authority": "Operator-related process-design source.",
      "content_hash": "3db22fd7f61b597a4c42d326374eb53bd9fb0cf3e1af600cc5c2149a885eaa53",
      "contradictions": [
        "Its multi-framework synthesis should not be treated as a direct NARM claim."
      ],
      "contributions": [
        "Context for later framework integration.",
        "Candidate practices and sequence for later method ranking."
      ],
      "freshness": "Current configured source.",
      "key_claims": [
        "It separates ethical pain from trauma charge as a working distinction.",
        "It describes anger, grief, trust, and regulation in a staged personal-development map.",
        "It treats multiple frameworks as layers rather than as one validated clinical model."
      ],
      "pointers": [
        "line:17",
        "line:33",
        "line:57",
        "line:134",
        "line:201",
        "line:299",
        "line:348"
      ],
      "repository_path": "apex-meta/kb/therapy/raw/notes/MyTherapy.md",
      "schema": "apex.kb.source-capsule.v2",
      "source_id": "src-f091a39587190b86",
      "summary": "Personal macro strategy that connects ethical pain, trauma charge, Jungian shadow work, Hawkins, ACIM, CBT, practical intention encoding, regulation, staged trust, and spiritual release.",
      "title": "MyTherapy",
      "uncertainties": [
        "The document is a personal process design, not independent clinical evidence."
      ]
    },
    {
      "authority": "Framework and practice source, not NARM authority.",
      "content_hash": "9ff6117ec7addb4713172f09e4fd2dc8b34c42bc678d3ca55dc71410040f5175",
      "contradictions": [
        "It uses a spiritual framework whose assumptions differ from NARM's psychotherapeutic framing."
      ],
      "contributions": [
        "Later framework-comparison evidence.",
        "Potential practice context with separate safety review."
      ],
      "freshness": "Current configured source.",
      "key_claims": [
        "It describes a surrender framework and exercises.",
        "It discusses guilt, connection, regulation, and attachment-related material.",
        "It is distinct from NARM and must retain its own source attribution."
      ],
      "pointers": [
        "line:50",
        "line:102",
        "line:128",
        "line:162",
        "line:188"
      ],
      "repository_path": "apex-meta/kb/therapy/raw/notes/Notion_Surrender_Page.md",
      "schema": "apex.kb.source-capsule.v2",
      "source_id": "src-f79b4940a5971c09",
      "summary": "Framework and practice material on surrender, Hawkins-style letting go, principles, and skill-tree exercises.",
      "title": "Notion Surrender Page",
      "uncertainties": [
        "No claim of clinical equivalence with NARM is supported by this source."
      ]
    },
    {
      "authority": "Operator self-report.",
      "content_hash": "a87da7087b42f18d10314a07da33485a588ae8add44fbdb79b8ee7a0538eae33",
      "contradictions": [],
      "contributions": [
        "Sets personal goals and energy-sensitive boundaries for later methods.",
        "Supports no diagnosis or medical recommendation."
      ],
      "freshness": "Current configured source.",
      "key_claims": [
        "The source reports chronic constraints and capacity limits.",
        "It requests self-regulation, release, anger and grief integration, and trauma-informed understanding.",
        "It identifies NARM and several other frameworks as desired inputs."
      ],
      "pointers": [
        "line:1",
        "line:7",
        "line:14",
        "line:20",
        "line:29"
      ],
      "repository_path": "apex-meta/kb/therapy/raw/notes/Anamesebogen.md",
      "schema": "apex.kb.source-capsule.v2",
      "source_id": "src-6a0cea0ce0c8e1ce",
      "summary": "Self-reported intake material naming health and energy constraints, therapy goals, anger and grievance themes, strengths, and interest in NARM, surrender, ACIM, Jung, and concrete tools.",
      "title": "Anamesebogen",
      "uncertainties": [
        "Health information is self-reported and must not be converted into medical guidance."
      ]
    },
    {
      "authority": "Operator personal insight.",
      "content_hash": "3a686acf11c2c4e99f698970697495ad1c86f931f45af8aba43733084fbdb241",
      "contradictions": [],
      "contributions": [
        "Potential example for later NARM-to-observation comparison."
      ],
      "freshness": "v2 current selected source.",
      "key_claims": [
        "It frames its claims as unfolding insight.",
        "It links presentation pressure with a wound around being seen, valued, chosen, or understood.",
        "It supplies a personal hypothesis, not a NARM definition."
      ],
      "pointers": [
        "line:7",
        "line:20",
        "line:31",
        "line:54",
        "line:122",
        "line:134"
      ],